{"schema": "receiptos.verify.request.v1", "verification_profile": "receiptos.verify.git-artifact.v1", "claim": {"kind": "SHA256_EQUALS", "expected_digest": "809b4dae623397f52742fe92f5c5d5bd22fbedaf8fc3a587523188bb5b8fe14d"}, "subject": {"kind": "git-artifact", "id": "root-audit-A", "artifact_digest": "809b4dae623397f52742fe92f5c5d5bd22fbedaf8fc3a587523188bb5b8fe14d", "commit": "bbbbbbbbbbbbbbbbbbbbbbbbbbbbbbbbbbbbbbbb", "tree": "9b9debc1bf1145346ab9917ade4d6bc5b4b1a3eb", "artifact_path": "artifact.txt", "version": "audit.v1"}, "policy": {"id": "audit-policy", "version": "audit.v1", "trusted_keys": [{"id": "audit-ed25519", "spki_base64": "MCowBQYDK2VwAyEAHjs/nnP9Aa7znsOcWB2UmpNsVIp2T5hi0Vc8gPoUTZI="}], "required_layers": [], "minimum_grade": "LOCAL_RECOMPUTATION", "verification_time": 1791676800}, "evidence": [], "semantic_requirement": {"claim_type": "SHA256_EQUALS", "authority_class": "INDEPENDENT_RECOMPUTATION", "subject": "root-audit-A", "scope": "artifact.txt", "valid_after": 0, "valid_until": 2000000000, "assumptions": [], "evidence_requirements": ["artifact", "execution"]}, "requested_guarantees": []}
